{
  "slug": "magician",
  "title": "Magician",
  "author": "Raymond E. Feist",
  "isbn13": "9780385175807",
  "firstPublished": 1982,
  "series": null,
  "genres": ["epic-fantasy"],
  "pace": "medium",
  "length": "long",
  "moods": ["epic", "adventurous"],
  "tropes": ["coming-of-age", "war-story", "magic-school"],
  "warnings": ["war", "violence", "death"],
  "summary": "Two orphan boys grow up in a castle on the edge of a kingdom, one destined to become a magician and the other a warrior. An invasion from another world pulls them into an enormous war.",
  "readIf": "you like classic, big-canvas fantasy that mixes personal growth with armies on the march.",
  "skipIf": "you want sharply drawn modern prose or a morally complex tone.",
  "pairings": [
    {
      "slug": "the-eye-of-the-world",
      "reason": "Another long-running classic fantasy series that starts from simple beginnings and grows enormous.",
      "moodShift": "bigger"
    },
    {
      "slug": "pawn-of-prophecy",
      "reason": "A friendlier, more comic traditional fantasy with a boy hero and a found family.",
      "moodShift": "lighter"
    },
    {
      "slug": "a-wizard-of-earthsea",
      "reason": "A short, quiet story of a gifted boy learning magic and responsibility.",
      "moodShift": "quieter"
    }
  ],
  "soldMillions": null,
  "tier": "modern",
  "sources": [
    "https://openlibrary.org/isbn/9780385175807",
    "https://en.wikipedia.org/wiki/Magician_(Feist_novel)",
    "https://hardcover.app/books/magician-master"
  ],
  "status": "checked",
  "checkedOn": "2026-10-16",
  "reviewedBy": null,
  "reviewedOn": null
}
