{
  "slug": "clockwork-angel",
  "title": "Clockwork Angel",
  "author": "Cassandra Clare",
  "isbn13": "9781406393279",
  "firstPublished": 2010,
  "series": null,
  "genres": ["young-adult", "fantasy", "historical"],
  "pace": "medium",
  "length": "long",
  "moods": ["adventurous", "mysterious", "swoony"],
  "tropes": ["love-triangle"],
  "warnings": ["violence"],
  "summary": "Tessa Gray arrives in Victorian London to find her brother and is pulled into a hidden world of demon hunters when she discovers she has a strange power of her own.",
  "readIf": "you like young adult fantasy with a Victorian setting and a romantic triangle.",
  "skipIf": "you want a stand-alone story or dislike teen romance.",
  "soldMillions": null,
  "tier": "modern",
  "sources": [],
  "status": "draft",
  "checkedOn": null,
  "reviewedBy": null,
  "reviewedOn": null
}
