{
  "slug": "the-awakening",
  "title": "The Awakening",
  "author": "Kate Chopin",
  "isbn13": "9781573920988",
  "firstPublished": 1899,
  "series": null,
  "genres": ["classic", "literary"],
  "pace": "slow",
  "length": "short",
  "moods": ["melancholic", "haunting", "thoughtful"],
  "tropes": [],
  "warnings": ["suicide", "infidelity"],
  "summary": "Edna Pontellier, a wife and mother in 1890s Louisiana, begins to resist the roles expected of her. A summer on the Gulf coast awakens a hunger for independence, art and love outside her marriage.",
  "readIf": "you enjoy short, lyrical classics about a woman pushing against the limits of her time.",
  "skipIf": "you want a plot-driven story or a happy resolution.",
  "soldMillions": null,
  "tier": "modern",
  "sources": [],
  "status": "draft",
  "checkedOn": null,
  "reviewedBy": null,
  "reviewedOn": null
}
