{
  "slug": "the-secret-life-of-bees",
  "title": "The Secret Life of Bees",
  "author": "Sue Monk Kidd",
  "isbn13": "9780143124320",
  "firstPublished": 2002,
  "series": null,
  "genres": ["literary", "historical"],
  "pace": "medium",
  "length": "medium",
  "moods": ["comforting", "hopeful", "nostalgic"],
  "tropes": ["found-family", "coming-of-age"],
  "warnings": ["racism", "abuse", "death", "suicide"],
  "summary": "In South Carolina in 1964, a lonely teenager runs away with her family's housekeeper and ends up at the home of three beekeeping sisters. Under their roof she starts to learn about her mother and herself.",
  "readIf": "you want a warm, lyrical coming-of-age story about women who raise and protect each other.",
  "skipIf": "you want a deep treatment of the civil rights era; it is mostly a personal story set against it.",
  "pairings": [
    {
      "slug": "the-help",
      "reason": "Another story of women and race in the 1960s American South, with similarly warm ensemble relationships.",
      "moodShift": "similar"
    },
    {
      "slug": "to-kill-a-mockingbird",
      "reason": "A classic Southern story told by a child narrator, with weightier themes of injustice.",
      "moodShift": "darker"
    },
    {
      "slug": "where-the-crawdads-sing",
      "reason": "Another girl abandoned by her family finds support in nature and a few kind people.",
      "moodShift": "similar"
    }
  ],
  "soldMillions": null,
  "tier": "modern",
  "sources": [],
  "status": "draft",
  "checkedOn": null,
  "reviewedBy": null,
  "reviewedOn": null
}
