{
  "slug": "martin-eden",
  "title": "Martin Eden",
  "author": "Jack London",
  "isbn13": "9781461039785",
  "firstPublished": 1909,
  "series": null,
  "genres": ["classic", "literary", "adventure"],
  "pace": "medium",
  "length": "long",
  "moods": ["thoughtful", "melancholic", "inspiring"],
  "tropes": ["rags-to-riches", "coming-of-age"],
  "warnings": ["suicide", "mental-illness"],
  "summary": "Martin Eden, a poor young sailor, falls for a middle-class woman and sets out to educate himself and become a writer. As success arrives, it brings him far less than he had imagined.",
  "readIf": "you like semi-autobiographical novels about ambition, class and self-education.",
  "skipIf": "you need an uplifting ending or are sensitive to depictions of despair.",
  "soldMillions": null,
  "tier": "modern",
  "sources": [],
  "status": "draft",
  "checkedOn": null,
  "reviewedBy": null,
  "reviewedOn": null
}
